ID,Poster_Link,Series_Title,Released_Year,Certificate,Runtime_Minutes,IMDB_Rating,Overview,Meta_score,Star1,Star2,Star3,Star4,No_of_Votes,Gross,Director_Name,Genre,Country_Origin
480,"https://m.media-amazon.com/images/M/MV5BZGIzNWYzN2YtMjcwYS00YjQ3LWI2NjMtOTNiYTUyYjE2MGNkXkEyXkFqcGdeQXVyMTQxNzMzNDI@._V1_UX67_CR0,0,67,98_AL_.jpg",X-men: Days Of Future Past,2014.0,UA,132,7.9,The X-Men send Wolverine to the past in a desperate effort to change history and prevent an event that results in doom for both humans and mutants.,74.0,Patrick Stewart,Ian Mckellen,Hugh Jackman,James Mcavoy,659763.0,233921534.0,Bryan Singer,"Action, Adventure, Sci-Fi",USA
481,"https://m.media-amazon.com/images/M/MV5BYTRkMDRiYmEtNGM4YS00NzM3LWI4MTMtYzk1MmVjMjM3ODg1XkEyXkFqcGdeQXVyMjgyNjk3MzE@._V1_UY98_CR1,0,67,98_AL_.jpg",Bir Zamanlar Anadolu'da,2011.0,Unknown,157,7.9,A group of men set out in search of a dead body in the Anatolian steppes.,Unknown,Muhammet Uzuner,Yilmaz Erdogan,Taner Birsel,Ahmet Mümtaz Taylan,Unknown,Unknown,Nuri Bilge Ceylan,"Crime, Drama",Turkey
482,"https://m.media-amazon.com/images/M/MV5BMDUyZWU5N2UtOWFlMy00MTI0LTk0ZDYtMzFhNjljODBhZDA5XkEyXkFqcGdeQXVyNzA4ODc3ODU@._V1_UY98_CR1,0,67,98_AL_.jpg",The Artist,2011.0,U,100,7.9,An egomaniacal film star develops a relationship with a young dancer against the backdrop of Hollywood's silent era.,89.0,Jean Dujardin,Bérénice Bejo,John Goodman,James Cromwell,230624.0,44671682.0,Michel Hazanavicius,"Comedy, Drama, Romance",France
483,"https://m.media-amazon.com/images/M/MV5BMTc5OTk4MTM3M15BMl5BanBnXkFtZTgwODcxNjg3MDE@._V1_UX67_CR0,0,67,98_AL_.jpg",Edge Of Tomorrow,2014.0,UA,113,7.9,A soldier fighting aliens gets to relive the same day over and over again.,71.0,Tom Cruise,Emily Blunt,Bill Paxton,Brendan Gleeson,600004.0,100206256.0,Doug Liman,"Action, Adventure, Sci-Fi",USA
484,"https://m.media-amazon.com/images/M/MV5BMTk1NTc3NDc4MF5BMl5BanBnXkFtZTcwNjYwNDk0OA@@._V1_UX67_CR0,0,67,98_AL_.jpg",Amour,2012.0,UA,127,7.9,"Georges and Anne are an octogenarian couple. They are cultivated, retired music teachers. Their daughter, also a musician, lives in Britain with her family. One day, Anne has a stroke, and the couple's bond of love is severely tested.",Unknown,Jean-louis Trintignant,Emmanuelle Riva,Isabelle Huppert,Alexandre Tharaud,93090.0,6739492.0,Michael Haneke,"Drama, Romance",France
485,"https://m.media-amazon.com/images/M/MV5BMGUyM2ZiZmUtMWY0OC00NTQ4LThkOGUtNjY2NjkzMDJiMWMwXkEyXkFqcGdeQXVyMzY0MTE3NzU@._V1_UX67_CR0,0,67,98_AL_.jpg",The Irishman,2019.0,R,209,7.9,"An old man recalls his time painting houses for his friend, Jimmy Hoffa, through the 1950-70s.",94.0,Robert De Niro,Al Pacino,Joe Pesci,Harvey Keitel,324720.0,7000000.0,Martin Scorsese,"Biography, Crime, Drama",USA
486,"https://m.media-amazon.com/images/M/MV5BMTUyMjQ1MTY5OV5BMl5BanBnXkFtZTcwNzY5NjExMw@@._V1_UY98_CR1,0,67,98_AL_.jpg",Un Prophète,2009.0,A,155,7.9,A young Arab man is sent to a French prison.,90.0,Tahar Rahim,Niels Arestrup,Adel Bencherif,Reda Kateb,93560.0,2084637.0,Jacques Audiard,"Crime, Drama",France
487,"https://m.media-amazon.com/images/M/MV5BMTgzODgyNTQwOV5BMl5BanBnXkFtZTcwNzc0NTc0Mg@@._V1_UX67_CR0,0,67,98_AL_.jpg",Moon,2009.0,R,97,7.9,"Astronaut Sam Bell has a quintessentially personal encounter toward the end of his three-year stint on the Moon, where he, working alongside his computer, GERTY, sends back to Earth parcels of a resource that has helped diminish our planet's power problems.",67.0,Sam Rockwell,Kevin Spacey,Dominique Mcelligott,Rosie Shaw,335152.0,5009677.0,Duncan Jones,"Drama, Mystery, Sci-Fi",UK
488,"https://m.media-amazon.com/images/M/MV5BOWM4NTY2NTMtZDZlZS00NTgyLWEzZDMtODE3ZGI1MzI3ZmU5XkEyXkFqcGdeQXVyNzI1NzMxNzM@._V1_UY98_CR1,0,67,98_AL_.jpg",Let the Right One In,2008.0,R,114,7.9,"Oskar, an overlooked and bullied boy, finds love and revenge through Eli, a beautiful but peculiar girl.",82.0,Kåre Hedebrant,Lina Leandersson,Per Ragnar,Henrik Dahl,205609.0,Unknown,Tomas Alfredson,"Drama, Horror, Romance",Sweden
489,"https://m.media-amazon.com/images/M/MV5BYmQ5MzFjYWMtMTMwNC00ZGU5LWI3YTQtZzhkMGExNGFlY2Q0XkEyXkFqcGdeQXVyNTIzOTk5ODM@._V1_UX67_CR0,0,67,98_AL_.jpg",District 9,2009.0,A,112,7.9,"An alien race, feeling persecuted by Earth, is forced to live in slum-like conditions in South Africa and treated as second-class citizens.",81.0,Sharlto Copley,David James,Jason Cope,Nathalie Boltt,638202.0,115646235.0,Neill Blomkamp,"Action, Sci-Fi, Thriller",South Africa
490,"https://m.media-amazon.com/images/M/MV5BMTc5MjYyOTg4MF5BMl5BanBnXkFtZTcwNDc2MzQwMg@@._V1_UX67_CR0,0,67,98_AL_.jpg",The Wrestler,2008.0,UA,109,7.9,"A faded professional wrestler must retire, but finds his quest for a new life outside the ring a dispiriting struggle.",80.0,Mickey Rourke,Marisa Tomei,Evan Rachel Wood,Mark Margolis,289415.0,26236603.0,Darren Aronofsky,"Drama, Sport",USA
491,"https://m.media-amazon.com/images/M/MV5BYmIzYmY4MGItM2I4YS00OWZhLWFmMzQtYzI2MWY1MmM3NGU1XkEyXkFqcGdeQXVyNjQ2MjQ5NzM@._V1_UY98_CR0,0,67,98_AL_.jpg",Jab We Met,2007.0,U,138,7.9,A depressed wealthy businessman finds his life changing after he meets a spunky and care-free young woman.,Unknown,Shahid Kapoor,Kareena Kapoor,Tarun Arora,Dara Singh,47720.0,410800.0,Imtiaz Ali,"Comedy, Drama, Romance",India
492,"https://m.media-amazon.com/images/M/MV5BMTYzNDc2MDc0N15BMl5BanBnXkFtZTgwOTcwMDQ5MTE@._V1_UX67_CR0,0,67,98_AL_.jpg",Boyhood,2014.0,A,165,7.9,"The life of Mason, from early childhood to his arrival at college.",Unknown,Ellar Coltrane,Patricia Arquette,Ethan Hawke,Elijah Smith,335533.0,25379975.0,Richard Linklater,Drama,USA
493,"https://m.media-amazon.com/images/M/MV5BYzU1YWUzNjYtNmVhZi00ODUyLTg4M2ItMTFlMmU1Mzc5OTE5XkEyXkFqcGdeQXVyMTMxODk2OTU@._V1_UY98_CR1,0,67,98_AL_.jpg","4 Luni, 3 Saptamâni Si 2 Zile",2007.0,Unknown,113,7.9,A woman assists her friend in arranging an illegal abortion in 1980s Romania.,97.0,Anamaria Marinca,Laura Vasiliu,Vlad Ivanov,Alexandru Potocean,56625.0,Unknown,Cristian Mungiu,Drama,Romania
494,"https://m.media-amazon.com/images/M/MV5BMjE5NDQ5OTE4Ml5BMl5BanBnXkFtZTcwOTE3NDIzMw@@._V1_UX67_CR0,0,67,98_AL_.jpg",Star Trek,2009.0,UA,127,7.9,The brash James T. Kirk tries to live up to his father's legacy with Mr. Spock keeping him in check as a vengeful Romulan from the future creates black holes to destroy the Federation one planet at a time.,82.0,Chris Pine,Zachary Quinto,Simon Pegg,Leonard Nimoy,577336.0,257730019.0,J.j. Abrams,"Action, Adventure, Sci-Fi",USA
495,"https://m.media-amazon.com/images/M/MV5BMTUwOGFiM2QtOWMxYS00MjU2LThmZDMtZDM2MWMzNzllNjdhXkEyXkFqcGdeQXVyMTMxODk2OTU@._V1_UX67_CR0,0,67,98_AL_.jpg",In Bruges,2008.0,R,107,7.9,"Guilt-stricken after a job gone wrong, hitman Ray and his partner await orders from their ruthless boss in Bruges, Belgium, the last place in the world Ray wants to be.",67.0,Colin Farrell,Brendan Gleeson,Ralph Fiennes,Elizabeth Berrington,390334.0,7757130.0,Martin Mcdonagh,"Comedy, Crime, Drama",UK
496,"https://m.media-amazon.com/images/M/MV5BMzQ5NGQwOTUtNWJlZi00ZTFiLWI0ZTEtOGU3MTA2ZGU5OWZiXkEyXkFqcGdeQXVyMTczNjQwOTY@._V1_UX67_CR0,0,67,98_AL_.jpg",The Man From Earth,2007.0,Unknown,87,7.9,An impromptu goodbye party for Professor John Oldman becomes a mysterious interrogation after the retiring scholar reveals to his colleagues he has a longer and stranger past than they can imagine.,Unknown,David Lee Smith,Tony Todd,John Billingsley,Ellen Crawford,174125.0,Unknown,Richard Schenkman," Drama, Fantasy, Mystery ",USA
497,Unknown,Letters From Iwo Jima,2006.0,UA,141,7.9,"The story of the battle of Iwo Jima between the United States and Imperial Japan during World War II, as told from the perspective of the Japanese who fought it.",89.0,Ken Watanabe,Kazunari Ninomiya,Tsuyoshi Ihara,Ryô Kase,154011.0,13756082.0,Clint Eastwood,"Action, Adventure, Drama",USA
498,"https://m.media-amazon.com/images/M/MV5BMjAzODUwMjM1M15BMl5BanBnXkFtZTcwNjU2MjU2MQ@@._V1_UX67_CR0,0,67,98_AL_.jpg",The Fall,2006.0,R,117,7.9,"In a hospital on the outskirts of 1920s Los Angeles, an injured stuntman begins to tell a fellow patient, a little girl with a broken arm, a fantastic story of five mythical heroes. Thanks to his fractured state of mind and her vivid imagination, the line between fiction and reality blurs as the tale advances.",64.0,Lee Pace,Catinca Untaru,Justine Waddell,Kim Uylenbroek,107290.0,2280348.0,Tarsem Singh," Adventure, Drama, Fantasy ",USA
499,"https://m.media-amazon.com/images/M/MV5BNTg2OTY2ODg5OF5BMl5BanBnXkFtZTcwODM5MTYxOA@@._V1_UX67_CR0,0,67,98_AL_.jpg",Life Of Pi,2012.0,U,127,7.9,"A young man who survives a disaster at sea is hurtled into an epic journey of adventure and discovery. While cast away, he forms an unexpected connection with another survivor: a fearsome Bengal tiger.",79.0,Suraj Sharma,Irrfan Khan,Adil Hussain,Tabu,580708.0,124987023.0,Ang Lee," Adventure, Drama, Fantasy ",USA
500,"https://m.media-amazon.com/images/M/MV5BOGUwYTU4NGEtNDM4MS00NDRjLTkwNmQtOTkwMWMyMjhmMjdlXkEyXkFqcGdeQXVyMTMxODk2OTU@._V1_UX67_CR0,0,67,98_AL_.jpg",Fantastic Mr. Fox,2009.0,PG,87,7.9,An urbane fox cannot resist returning to his farm raiding ways and then must help his community survive the farmers' retaliation.,83.0,George Clooney,Meryl Streep,Bill Murray,Jason Schwartzman,199696.0,21002919.0,Wes Anderson," Animation, Adventure, Comedy ",USA
501,"https://m.media-amazon.com/images/M/MV5BMTU3MDc2MjUwMV5BMl5BanBnXkFtZTcwNzQyMDAzMQ@@._V1_UY98_CR0,0,67,98_AL_.jpg",C.r.a.z.y.,2005.0,Unknown,129,7.9,"A young French-Canadian, growing up in the 1960s and 1970s, struggles to reconcile his emerging homosexuality with his father's conservative values and his own Catholic beliefs.",81.0,Michel Côté,Unknown,Danielle Proulx,Émile Vallée,31476.0,Unknown,Jean-marc Vallée," Comedy, Drama ",Canada
502,"https://m.media-amazon.com/images/M/MV5BOGY1M2MwOTEtZDIyNi00YjNlLWExYmEtNzBjOGI3N2QzNTg5XkEyXkFqcGdeQXVyMTMxODk2OTU@._V1_UX67_CR0,0,67,98_AL_.jpg",Les Choristes,2004.0,PG-13,97,7.9,A new teacher at a boarding school for wayward boys tries to positively affect his students' lives through music.,56.0,Gérard Jugnot,François Berléeand,Jean-baptiste Maunier,Unknown,57430.0,3635164.0,Christophe Barratier,"Drama, Music",France
503,,Iron Man,2008.0,UA,126,7.9,"After being held captive in an Afghan cave, billionaire engineer Tony Stark creates a unique weaponized suit of armor to fight evil.",79.0,Robert Downey Jr.,Gwyneth Paltrow,Terrence Howard,Jeff Bridges,939644.0,Unknown,Jon Favreau,"Action, Adventure, Sci-Fi",USA
504,"https://m.media-amazon.com/images/M/MV5BMTg5Mjk2NDMtZTk0Ny00YTQ0LWIzYWEtMWI5MGQ0Mjg1OTNkXkEyXkFqcGdeQXVyNzkwMjQ5NzM@._V1_UX67_CR0,0,67,98_AL_.jpg",Shaun Of The Dead,2004.0,UA,99,7.9,A man's uneventful life is disrupted by the zombie apocalypse.,76.0,Simon Pegg,Nick Frost,Kate Ashfield,Lucy Davis,512249.0,13542874.0,Edgar Wright," Comedy, Horror ",UK
505,"https://m.media-amazon.com/images/M/MV5BODBiNzYxNzYtMjkyMi00MjUyLWJkM2YtZjNkMDhhYmEwMTRiL2ltYWdlXkEyXkFqcGdeQXVyNTAyODkwOQ@@._V1_UY98_CR1,0,67,98_AL_.jpg",Gegen Die Wand,2004.0,R,121,7.9,"With the intention to break free from the strict familial restrictions, a suicidal young woman sets up a marriage of convenience with a forty-year-old addict, an act that will lead to an outburst of envious love.",78.0,Birol Ünel,Sibel Kekilli,Güven Kiraç,Zarah Jane Mckenzie,Unknown,Unknown,Fatih Akin," Drama, Romance ",Germany
506,"https://m.media-amazon.com/images/M/MV5BMTIzNDUyMjA4MV5BMl5BanBnXkFtZTYwNDc4ODM3._V1_UX67_CR0,0,67,98_AL_.jpg",Mystic River,2003.0,A,138,7.9,"The lives of three childhood friends are shattered by a past tragedy, and they are brought together again by a new one.",84.0,Sean Penn,Tim Robbins,Kevin Bacon,Emmy Rossum,419420.0,90135191.0,Clint Eastwood," Crime, Drama, Mystery ",USA
507,"https://m.media-amazon.com/images/M/MV5BMTY4NTIwODg0N15BMl5BanBnXkFtZTcwOTc0MjEzMw@@._V1_UX67_CR0,0,67,98_AL_.jpg",Harry Potter And The Prisoner Of Azkaban,2004.0,U,142,7.9,"Harry Potter, Ron and Hermione return to Hogwarts School of Witchcraft and Wizardry for their third year of study, where they delve into the mystery surrounding an escaped prisoner who poses a dangerous threat to the young wizard.",82.0,Daniel Radcliffe,Emma Watson,Rupert Grint,Richard Griffiths,552493.0,249358727.0,Alfonso Cuarón,"Adventure, Family, Fantasy",UK
508,"https://m.media-amazon.com/images/M/MV5BMWQ2MjQ0OTctMWE1OC00NjZjLTk3ZDAtNTk3NTZiYWMxYTlmXkEyXkFqcGdeQXVyMTQxNzMzNDI@._V1_UX67_CR0,0,67,98_AL_.jpg",Ying Xiong,2002.0,PG-13,120,7.9,"A defense officer, Nameless, was summoned by the King of Qin regarding his success of terminating three warriors.",85.0,Jet LI,Tony Leung Chiu-Wai,Maggie Cheung,Ziyi Zhang,173999.0,53710019.0,Yimou Zhang," Action, Adventure, History ",China
509,"https://m.media-amazon.com/images/M/MV5BYmVmMGQ3NzEtM2FiNi00YThhLWFkZjYtM2Y0MjZjNGE4NzM0XkEyXkFqcGdeQXVyODc0OTEyNDU@._V1_UY98_CR1,0,67,98_AL_.jpg",Hable Con Ella,2002.0,R,112,7.9,"Two men, a writer and a nurse, share a unique bond of friendship while tending to two women in comas at a clinic in Spain.",Unknown,Rosario Flores,Javier Cámara,Darío Grandinetti,Leonor Watling,104691.0,9284265.0,Pedro Almodóvar,"Drama, Mystery, Romance",Spain
510,"https://m.media-amazon.com/images/M/MV5BMGFkNjNmZWMtNDdiOS00ZWM3LWE1ZTMtZDU3MGQyMzIyNzZhXkEyXkFqcGdeQXVyMTMxODk2OTU@._V1_UX67_CR0,0,67,98_AL_.jpg",No Man's Land,2001.0,R,98,7.9,"Bosnia and Herzegovina during 1993 at the time of the heaviest fighting between the two warring sides. Two soldiers from opposing sides in the conflict, Nino and Ciki, become trapped in no man's land, whilst a third soldier becomes a living booby trap.",84.0,Branko Djuric,Rene Bitorajac,Filip Sovagovic,Georges Siatidis,Unknown,1059830.0,Danis Tanovic,"Comedy, Drama, War",Bosnia and Herzegovina
511,"https://m.media-amazon.com/images/M/MV5BMjYzYWM4YTItZjJiMC00OTM5LTg3NDgtOGQ2Njk2ZWNhN2QwXkEyXkFqcGdeQXVyMzM4MjM0Nzg@._V1_UY98_CR0,0,67,98_AL_.jpg",Cowboy Bebop: Tengoku No Tobira,2001.0,U,115,7.9,"The year is 2071, and Mars has been colonized by humans. A terrorist bombing releases a deadly virus, and the bounty hunter crew of the Bebop attempts to track down the perpetrator.",61.0,Tensai Okamura,Hiroyuki Okiura,Yoshiyuki Takei,Beau Billingslea,42897.0,1000045.0,Shin'ichirô Watanabe,"Animation, Action, Crime",Japan
512,"https://m.media-amazon.com/images/M/MV5BM2JkNGU0ZGMtZjVjNS00NjgyLWEyOWYtZmRmZGQyN2IxZjA2XkEyXkFqcGdeQXVyNTIzOTk5ODM@._V1_UX67_CR0,0,67,98_AL_.jpg",The Bourne Identity,2002.0,UA,119,7.9,"A man is picked up by a fishing boat, bullet-riddled and suffering from amnesia, before racing to elude assassins and attempting to regain his memory.",68.0,Franka Potente,Matt Damon,Chris Cooper,Clive Owen,508771.0,121661683.0,Doug Liman,"Action, Mystery, Thriller",USA
513,"https://m.media-amazon.com/images/M/MV5BMTYxMDdlYjItMDVkYy00MjYzLThhMTYtYjIzZjZiODk1ZWRmXkEyXkFqcGdeQXVyNDk3NzU2MTQ@._V1_UX67_CR0,0,67,98_AL_.jpg",Nueve Reinas,2000.0,R,114,7.9,"Two con artists try to swindle a stamp collector by selling him a sheet of counterfeit rare stamps (the ""nine queens"").",80.0,Ricardo Darín,Gastón Pauls,Graciela Tenenbaum,María Mercedes Villagra,49721.0,1221261.0,Fabián Bielinsky," Crime, Drama, Thriller ",Argentina
514,"https://m.media-amazon.com/images/M/MV5BMTQ5NTI2NTI4NF5BMl5BanBnXkFtZTcwNjk2NDA2OQ@@._V1_UX67_CR0,0,67,98_AL_.jpg",Children of Men,2006.0,R,109,7.9,"In 2027, in a chaotic world in which women have become somehow infertile, a former activist agrees to help transport a miraculously pregnant woman to a sanctuary at sea.",84.0,Julianne Moore,Clive Owen,Chiwetel Ejiofor,Michael Caine,465113.0,35552383.0,Alfonso Cuarón,"Drama, Sci-Fi, Thriller",United Kingdom
515,"https://m.media-amazon.com/images/M/MV5BMzY1ZjMwMGEtYTY1ZS00ZDllLTk0ZmUtYzA3ZTA4NmYwNGNkXkEyXkFqcGdeQXVyNDk3NzU2MTQ@._V1_UX67_CR0,0,67,98_AL_.jpg",Almost Famous,2000.0,A,122,7.9,A high-school boy is given the chance to write a story for Rolling Stone Magazine about an up-and-coming rock band as he accompanies them on their concert tour.,90.0,Billy Crudup,Patrick Fugit,Kate Hudson,Frances Mcdormand,252586.0,32534850.0,Cameron Crowe," Adventure, Comedy, Drama ",USA
516,"https://m.media-amazon.com/images/M/MV5BYjBhZmViNTItMGExMy00MGNmLTkwZDItMDVlMTQ4ODVkYTMwXkEyXkFqcGdeQXVyNzM0MTUwNTY@._V1_UY98_CR1,0,67,98_AL_.jpg",Mulholland Dr.,2001.0,R,147,7.9,"After a car wreck on the winding Mulholland Drive renders a woman amnesiac, she and a perky Hollywood-hopeful search for clues and answers across Los Angeles in a twisting venture beyond dreams and reality.",85.0,Naomi Watts,Laura Harring,Justin Theroux,Jeanne Bates,322031.0,7220243.0,David Lynch,"Drama, Mystery, Thriller",USA
517,"https://m.media-amazon.com/images/M/MV5BMDU2ZWQzNzktMDRlNS00ZmU3LThkYzUtMTE0ZWFkYzFkYjQ1XkEyXkFqcGdeQXVyNDQ2OTk4MzI@._V1_UX67_CR0,0,67,98_AL_.jpg",Toy Story 2,1999.0,U,92,7.9,"When Woody is stolen by a toy collector, Buzz and his friends set out on a rescue mission to save Woody before he becomes a museum toy property with his roundup gang Jessie, Prospector, and Bullseye.",88.0,Ash Brannon,Lee Unkrich,Tom Hanks,Tim Allen,527512.0,245852179.0,John Lasseter," Animation, Adventure, Comedy ",USA
518,"https://m.media-amazon.com/images/M/MV5BMjYwOTQ0NzMxM15BMl5BanBnXkFtZTgwNTUxNzMwNzM@._V1_UX67_CR0,0,67,98_AL_.jpg",Boogie Nights,1997.0,R,155,7.9,"Back when sex was safe, pleasure was a business and business was booming, an idealistic porn producer aspires to elevate his craft to an art when he discovers a hot young talent.",85.0,Mark Wahlberg,Julianne Moore,Burt Reynolds,Luis Guzmán,239473.0,26400640.0,Paul Thomas Anderson, Drama ,USA
519,"https://m.media-amazon.com/images/M/MV5BZDg0MWNmNjktMGEwZC00ZDlmLWI1MTUtMDBmNjQzMWM2NjBjXkEyXkFqcGdeQXVyMTMxODk2OTU@._V1_UX67_CR0,0,67,98_AL_.jpg",Mimi Wo Sumaseba,1995.0,U,111,7.9,"A love story between a girl who loves reading books, and a boy who has previously checked out all of the library books she chooses.",75.0,Yoko Honna,Issey Takahashi,Takashi Tachibana,Shigeru Muroi,51943.0,Unknown,Yoshifumi Kondô,"Animation, Drama, Family",Japan
520,"https://m.media-amazon.com/images/M/MV5BYTY4MTdjZDMtOTBiMC00MDEwLThhMjUtMjlhMjdlYTBmMzk3XkEyXkFqcGdeQXVyNjMwMjk0MTQ@._V1_UY98_CR1,0,67,98_AL_.jpg",Once Were Warriors,1994.0,A,102,7.9,A family descended from Maori warriors is bedeviled by a violent father and the societal problems of being treated as outcasts.,77.0,Rena Owen,Temuera Morrison,Mamaengaroa Kerr-bell,Julian Arahanga,31590.0,2201126.0,Lee Tamahori,"Crime, Drama",New Zealand
521,"https://m.media-amazon.com/images/M/MV5BMDViNjFjOWMtZGZhMi00NmIyLThmYzktODA4MzJhZDZhMDc5XkEyXkFqcGdeQXVyNzkwMjQ5NzM@._V1_UY98_CR1,0,67,98_AL_.jpg",True Romance,1993.0,Unknown,119,7.9,"In Detroit, a lonely pop culture geek marries a call girl, steals cocaine from her pimp, and tries to sell it in Hollywood. Meanwhile, the owners of the cocaine, the Mob, track them down in an attempt to reclaim it.",59.0,Christian Slater,Patricia Arquette,Dennis Hopper,Val Kilmer,Unknown,12281500.0,Tony Scott," Crime, Drama, Romance ",USA
522,"https://m.media-amazon.com/images/M/MV5BMjg5OGU4OGYtNTZmNy00MjQ1LWIzYzgtMTllMGY2NzlkNzYwXkEyXkFqcGdeQXVyMTI3ODAyMzE2._V1_UY98_CR2,0,67,98_AL_.jpg",Trois Couleurs: Bleu,1993.0,Unknown,94,7.9,A woman struggles to find a way to live her life after the death of her husband and child.,85.0,Juliette Binoche,Zbigniew Zamachowski,Julie Delpy,Benoît Régent,89836.0,1324974.0,Krzysztof Kieslowski,"Drama, Music, Mystery",France
523,Unknown,Ninja Scroll,1993.0,A,94,7.9,A vagabond swordsman is aided by a beautiful ninja girl and a crafty spy in confronting a demonic clan of killers - with a ghost from his past as their leader - who are bent on overthrowing the Tokugawa Shogunate.,Unknown,Kôichi Yamadera,Emi Shinohara,Takeshi Aono,Osamu Saka,34529.0,Unknown,Yoshiaki Kawajiri," Animation, Action, Adventure ",Japan
524,"https://m.media-amazon.com/images/M/MV5BN2I2N2Q1YmMtMzZkMC00Y2JjLWJmOWUtNjc2OTM2ZTk1MjUyXkEyXkFqcGdeQXVyNzkwMjQ5NzM@._V1_UX67_CR0,0,67,98_AL_.jpg",Carlito's Way,1993.0,A,144,7.9,"A Puerto Rican former convict, just released from prison, pledges to stay away from drugs and violence despite the pressure around him and lead on to a better life outside of N.Y.C.",65.0,Al Pacino,Sean Penn,Penelope Ann Miller,John Leguizamo,201000.0,36948322.0,Brian De Palma,"Crime, Drama, Thriller",USA
525,"https://m.media-amazon.com/images/M/MV5BNDUxN2I5NDUtZjdlMC00NjlmLTg0OTQtNjk0NjAxZjFmZTUzXkEyXkFqcGdeQXVyMTQxNzMzNDI@._V1_UX67_CR0,0,67,98_AL_.jpg",Edward Scissorhands,1990.0,U,Unknown,7.9,"An artificial man, who was incompletely constructed and has scissors for hands, leads a solitary life. Then one day, a suburban lady meets him and introduces him to her world.",Unknown,Johnny Depp,Winona Ryder,Dianne Wiest,Anthony Michael Hall,447368.0,56362352.0,Tim Burton," Drama, Fantasy, Romance ",USA
526,"https://m.media-amazon.com/images/M/MV5BYjdkNzA4MzYtZThhOS00ZDgzLTlmMDItNmY1ZjI5YjkzZTE1XkEyXkFqcGdeQXVyMTQxNzMzNDI@._V1_UX67_CR0,0,67,98_AL_.jpg",My Left Foot,1989.0,U,103,7.9,"Christy Brown, born with cerebral palsy, learns to paint and write with his only controllable limb - his left foot.",97.0,Daniel Day-lewis,Brenda Fricker,Alison Whelan,Unknown,68076.0,14743391.0,Jim Sheridan,"Biography, Drama",Ireland
527,"https://m.media-amazon.com/images/M/MV5BYWY3N2EyOWYtNDVhZi00MWRkLTg2OTUtODNkNDQ5ZTIwMGJkXkEyXkFqcGdeQXVyMTMxODk2OTU@._V1_UX67_CR0,0,67,98_AL_.jpg",Crimes And Misdemeanors,1989.0,PG-13,104,7.9,An ophthalmologist's mistress threatens to reveal their affair to his wife while a married documentary filmmaker is infatuated with another woman.,77.0,Martin Landau,Woody Allen,Bill Bernstein,Unknown,54670.0,18254702.0,Woody Allen,"Comedy, Drama",USA
528,"https://m.media-amazon.com/images/M/MV5BYTVjYWJmMWQtYWU4Ni00MWY3LWI2YmMtNTI5MDE0MWVmMmEzL2ltYWdlXkEyXkFqcGdeQXVyMTQxNzMzNDI@._V1_UX67_CR0,0,67,98_AL_.jpg",The Untouchables,1987.0,Unknown,119,7.9,"During the era of Prohibition in the United States, Federal Agent Eliot Ness sets out to stop ruthless Chicago gangster Al Capone and, because of rampant corruption, assembles a small, hand-picked team to help him.",79.0,Kevin Costner,Sean Connery,Robert De Niro,Charles Martin Smith,281842.0,76270454.0,Brian De Palma,"Crime, Drama, Thriller",USA
529,"https://m.media-amazon.com/images/M/MV5BMWZiNWUwYjMtM2Y1Yi00MTZmLWEwYzctNjVmYWM0OTFlZDFhXkEyXkFqcGdeQXVyMTMxODk2OTU@._V1_UX67_CR0,0,67,98_AL_.jpg",Hannah And Her Sisters,1986.0,PG-13,107,7.9,"Between two Thanksgivings two years apart, Hannah's husband falls in love with her sister Lee, while her hypochondriac ex-husband rekindles his relationship with her sister Holly.",90.0,Mia Farrow,Dianne Wiest,Michael Caine,Barbara Hershey,67176.0,40084041.0,Woody Allen,"Comedy, Drama",USA
530,"https://m.media-amazon.com/images/M/MV5BMzIwM2IwYTItYmM4Zi00OWMzLTkwNjAtYWRmYWNmY2RhMDk0XkEyXkFqcGdeQXVyNjU0OTQ0OTY@._V1_UX67_CR0,0,67,98_AL_.jpg",Brazil,1985.0,U,132,7.9,A bureaucrat in a dystopic society becomes an enemy of the state as he pursues the woman of his dreams.,84.0,Jonathan Pryce,Kim Greist,Robert De Niro,Katherine Helmond,187567.0,9929135.0,Terry Gilliam,"Comedy, Drama, Sci-Fi",UK
531,"https://m.media-amazon.com/images/M/MV5BMTQ2MTIzMzg5Nl5BMl5BanBnXkFtZTgwOTc5NDI1MDE@._V1_UX67_CR0,0,67,98_AL_.jpg",This Is Spinal Tap,1984.0,R,82,7.9,"Spinal Tap, one of England's loudest bands, is chronicled by film director Marty DiBergi on what proves to be a fateful tour.",92.0,Unknown,Unknown,Christopher Guest,Kimberly Stringer,128812.0,Unknown,Rob Reiner,"Comedy, Music",USA
532,"https://m.media-amazon.com/images/M/MV5BOWMyNjE0MzEtMzVjNy00NjIxLTg0ZjMtMWJhNGI1YmVjYTczL2ltYWdlXkEyXkFqcGdeQXVyNzc5MjA3OA@@._V1_UX67_CR0,0,67,98_AL_.jpg",A Christmas Story,1983.0,U,93,7.9,"In the 1940s, a young boy named Ralphie attempts to convince his parents, his teacher and Santa that a Red Ryder BB gun really is the perfect Christmas gift.",77.0,Peter Billingsley,Melinda Dillon,Darren Mcgavin,Scott Schwartz,132947.0,20605209.0,Bob Clark," Comedy, Family ",USA
533,"https://m.media-amazon.com/images/M/MV5BYTdlMDExOGUtN2I3MS00MjY5LWE1NTAtYzc3MzIxN2M3OWY1XkEyXkFqcGdeQXVyNzkwMjQ5NzM@._V1_UX67_CR0,0,67,98_AL_.jpg",The Blues Brothers,1980.0,U,133,7.9,"Jake Blues, just released from prison, puts together his old band to save the Catholic home where he and his brother Elwood were raised.",60.0,Unknown,Dan Aykroyd,Cab Calloway,Unknown,183182.0,57229890.0,John Landis,"Action, Adventure, Comedy",USA
534,"https://m.media-amazon.com/images/M/MV5BMzdmY2I3MmEtOGFiZi00MTg1LWIxY2QtNWUwM2NmNWNlY2U5XkEyXkFqcGdeQXVyNDk3NzU2MTQ@._V1_UX67_CR0,0,67,98_AL_.jpg",Manhattan,1979.0,R,96,7.9,The life of a divorced television writer dating a teenage girl is further complicated when he falls in love with his best friend's mistress.,83.0,Woody Allen,Diane Keaton,Mariel Hemingway,Michael Murphy,131436.0,45700000.0,Woody Allen," Comedy, Drama, Romance ",USA
535,"https://m.media-amazon.com/images/M/MV5BZWE4N2JkNDUtZDU4MC00ZjNhLTlkMjYtOTNkMjZhMDAwMDMyXkEyXkFqcGdeQXVyMTA0MjU0Ng@@._V1_UX67_CR0,0,67,98_AL_.jpg",All That Jazz,1979.0,A,123,7.9,"Director/choreographer Bob Fosse tells his own life story as he details the sordid career of Joe Gideon, a womanizing, drug-using dancer.",72.0,Roy Scheider,Jessica Lange,Ann Reinking,Unknown,28223.0,37823676.0,Bob Fosse,"Drama, Music, Musical",USA
536,"https://m.media-amazon.com/images/M/MV5BMzc1YTIyNjctYzhlNy00ZmYzLWI2ZWQtMzk4MmQwYzA0NGQ1XkEyXkFqcGdeQXVyMTQxNzMzNDI@._V1_UX67_CR0,0,67,98_AL_.jpg",Dawn Of The Dead,1978.0,A,127,7.9,A group of survivors take refuge in an abandoned shopping mall during a zombie apocalypse.,71.0,David Emge,Ken Foree,Scott H. Reiniger,Gaylen Ross,126136.0,5100000.0,George A. Romero,"Action, Adventure, Horror",USA
537,Unknown,All The President's Men,1976.0,R,138,7.9,Reporters Bob Woodward and Carl Bernstein uncover the details of the Watergate scandal.,84.0,Dustin Hoffman,Robert Redford,Jack Warden,Martin Balsam,103031.0,70600000.0,Alan J. Pakula,"Drama, History, Thriller",USA
